{
  "$schema": "https://json-schema.org/draft/2020-12/schema",
  "$id": "board.schema.json",
  "title": "board.json — 에이전트가 쓰고 캔버스가 읽는 보드 구성 (렌더러 중립)",
  "description": "화면 1장 = HTML 파일 1개. 한 화면을 devices 수만큼 기기 칸으로 나란히 보여준다. 좌표는 쓰지 않는다 — 줄(row)만 주면 줄 안 순서는 캔버스가 링크 흐름으로 정한다. 화면 안 <a href>는 캔버스가 따라가서, 링크가 든 컴포넌트에서 대상 화면으로 화살표를 그리고(그 버튼엔 빨간 테두리) board.json에 없는 페이지도 보드에 올린다(최대 20개). flows가 있으면 흐름 배치(위 흐름 지도 + 흐름 줄 + 가장 오른쪽 완성본, 모바일 구간 | PC 구간)로 보여주고, 없으면 줄(row) 배치로 보여준다",
  "examples": [
    {
      "title": "예시 서비스",
      "devices": [
        "mobile"
      ],
      "screens": [
        {
          "id": "home",
          "file": "screens/home.html",
          "title": "홈",
          "purpose": "오늘 할 일을 먼저 본다"
        },
        {
          "id": "item-edit",
          "file": "screens/item-edit.html",
          "title": "항목 편집",
          "devices": [
            "mobile",
            "desktop"
          ],
          "purpose": "항목 순서를 바꾸고 저장한다"
        }
      ],
      "flows": [
        {
          "id": "1",
          "title": "항목을 만들어 공유하기",
          "refs": "PRD §2-1 · G2",
          "steps": [
            "home",
            "item-edit"
          ]
        }
      ]
    }
  ],
  "type": "object",
  "additionalProperties": false,
  "required": [
    "title",
    "screens"
  ],
  "properties": {
    "title": {
      "type": "string"
    },
    "devices": {
      "description": "보드 기본 기기. 기본값 [\"mobile\"]. 화면별 devices가 있으면 그것이 우선한다.",
      "$ref": "#/$defs/deviceList",
      "default": [
        "mobile"
      ]
    },
    "rows": {
      "description": "줄 제목 (선택). flows가 있으면 쓰지 않는다 — flows가 없을 때의 예비 배치",
      "type": "array",
      "items": {
        "type": "object",
        "additionalProperties": false,
        "required": [
          "row",
          "title"
        ],
        "properties": {
          "row": {
            "type": "integer",
            "minimum": 0
          },
          "title": {
            "type": "string"
          }
        }
      }
    },
    "screens": {
      "type": "array",
      "minItems": 1,
      "items": {
        "type": "object",
        "additionalProperties": false,
        "required": [
          "id",
          "file",
          "title"
        ],
        "properties": {
          "id": {
            "type": "string",
            "pattern": "^[a-z0-9][a-z0-9-]*$",
            "description": "영문 소문자·숫자·하이픈. 캔버스 요소 id(screen:{id}@{device}, img:{id}@{device}:{data-id} 등 — lib/ids.js)에 쓰인다"
          },
          "file": {
            "type": "string",
            "description": "design/ 기준 상대 경로. 예: screens/home.html"
          },
          "title": {
            "type": "string"
          },
          "row": {
            "type": "integer",
            "minimum": 0,
            "default": 0,
            "description": "(flows가 없을 때만) 몇 번째 줄에 놓을지"
          },
          "order": {
            "type": "integer",
            "minimum": 0,
            "description": "(flows가 없을 때만) 줄 안 순서의 힌트"
          },
          "devices": {
            "$ref": "#/$defs/deviceList"
          },
          "purpose": {
            "type": "string",
            "description": "이 화면에서 하는 일 한 줄 (brief.md 화면 목록의 목적 칸). 흐름 배치에서 화면 제목 아래에 보인다"
          }
        }
      }
    },
    "arrows": {
      "description": "(선택) 링크로 드러나지 않는 흐름의 화살표나 라벨. flows가 있으면 보통 생략한다 — 흐름 줄의 화살표는 링크와 flows 순서로 그려지고, 라벨은 버튼 글자를 쓴다",
      "type": "array",
      "items": {
        "type": "object",
        "additionalProperties": false,
        "required": [
          "from",
          "to"
        ],
        "properties": {
          "from": {
            "type": "string"
          },
          "to": {
            "type": "string"
          },
          "label": {
            "type": "string",
            "description": "사용자가 하는 행동. 예: '항목 누름'"
          }
        }
      }
    },
    "round": {
      "type": "integer",
      "minimum": 0,
      "default": 0,
      "description": "피드백 라운드 번호. 에이전트가 feedback.json을 읽고 반영할 때 1 올린다 — 캔버스는 라운드가 다른 저장 상태를 버린다"
    },
    "flows": {
      "description": "사용자 흐름. 흐름 지도와 흐름 줄의 단위 — PRD 유저스토리·핵심 과업 하나당 하나, 3~5개. 모든 화면이 적어도 한 흐름에 들어간다. 여러 흐름에 나오는 화면은 처음 나온 흐름에서만 전체로, 뒤에서는 참조 카드로 보인다",
      "type": "array",
      "items": {
        "type": "object",
        "additionalProperties": false,
        "required": [
          "id",
          "title",
          "steps"
        ],
        "properties": {
          "id": {
            "type": "string",
            "description": "짧은 번호. 예: '1'. 보드에 '흐름 1'로 보인다"
          },
          "title": {
            "type": "string",
            "description": "목적 한 문장 — '무엇을 해서 무엇을 끝내기'"
          },
          "refs": {
            "type": "string",
            "description": "근거: 역할 · PRD 절 · 지침 G. 예: '주 사용자 · PRD §2-1 · G5 G7'"
          },
          "steps": {
            "type": "array",
            "minItems": 1,
            "items": {
              "type": "string"
            },
            "description": "화면 id를 흐름 순서대로"
          }
        }
      }
    }
  },
  "$defs": {
    "device": {
      "enum": [
        "mobile",
        "tablet",
        "desktop"
      ],
      "description": "devices.json의 키와 같아야 한다"
    },
    "deviceList": {
      "type": "array",
      "minItems": 1,
      "uniqueItems": true,
      "items": {
        "$ref": "#/$defs/device"
      }
    }
  }
}
